{
  "$schema": "https://json-schema.org/draft/2020-12/schema",
  "$id": "https://aligassrm.github.io/ALI-NEW/core/registry.schema.json",
  "title": "ALI & ALEX CORE Open-Ended Registry",
  "description": "Open-ended hierarchy. A nodes are top-level sections; B nodes are directly mapped resources/files; deeper uppercase-letter levels may represent tasks, issues, evidence, or further detail. Parent identity is always a full canonical route.",
  "type": "object",
  "additionalProperties": false,
  "required": [
    "schemaVersion",
    "registryStatus",
    "repositories",
    "nodes",
    "unmappedResources"
  ],
  "properties": {
    "schemaVersion": {
      "type": "string",
      "const": "2.0.0"
    },
    "registryStatus": {
      "type": "string",
      "enum": [
        "DRAFT",
        "PARTIALLY_VERIFIED",
        "VERIFIED"
      ]
    },
    "lastInventoryAt": {
      "type": [
        "string",
        "null"
      ],
      "format": "date-time"
    },
    "repositories": {
      "type": "array",
      "items": {
        "type": "object",
        "additionalProperties": false,
        "required": [
          "repositoryId",
          "fullName",
          "url",
          "approvalStatus",
          "defaultBranch",
          "visibility"
        ],
        "properties": {
          "repositoryId": {
            "type": "string",
            "pattern": "^R-[A-Z0-9-]+$"
          },
          "fullName": {
            "type": "string",
            "minLength": 3
          },
          "url": {
            "type": "string",
            "format": "uri"
          },
          "approvalStatus": {
            "type": "string",
            "enum": [
              "PENDING",
              "APPROVED",
              "REVOKED"
            ]
          },
          "defaultBranch": {
            "type": [
              "string",
              "null"
            ]
          },
          "visibility": {
            "type": "string",
            "enum": [
              "PUBLIC",
              "PRIVATE",
              "INTERNAL",
              "UNKNOWN"
            ]
          },
          "lastInspectedCommit": {
            "type": [
              "string",
              "null"
            ]
          },
          "lastSuccessfulSyncAt": {
            "type": [
              "string",
              "null"
            ],
            "format": "date-time"
          }
        }
      }
    },
    "nodes": {
      "type": "array",
      "items": {
        "type": "object",
        "additionalProperties": false,
        "required": [
          "id",
          "level",
          "parentId",
          "name",
          "status",
          "resourceType"
        ],
        "properties": {
          "id": {
            "type": "string",
            "pattern": "^[A-Z][0-9]+$"
          },
          "level": {
            "type": "string",
            "pattern": "^[A-Z]$"
          },
          "parentId": {
            "type": [
              "string",
              "null"
            ],
            "pattern": "^A[0-9]+(?:/[A-Z][0-9]+)*$"
          },
          "name": {
            "type": "string",
            "minLength": 1
          },
          "status": {
            "type": "string",
            "enum": [
              "PLANNED",
              "UNMAPPED",
              "YELLOW",
              "ORANGE",
              "GREEN",
              "LOCKED",
              "RED",
              "RETIRED"
            ]
          },
          "resourceType": {
            "type": "string",
            "enum": [
              "REPOSITORY",
              "SECTION",
              "FILE",
              "WORKFLOW",
              "TEST",
              "ISSUE",
              "PULL_REQUEST",
              "COMMIT",
              "SERVICE",
              "EVIDENCE",
              "DOCUMENT",
              "OTHER"
            ]
          },
          "repositoryFullName": {
            "type": [
              "string",
              "null"
            ]
          },
          "path": {
            "type": [
              "string",
              "null"
            ]
          },
          "url": {
            "type": [
              "string",
              "null"
            ],
            "format": "uri"
          },
          "branch": {
            "type": [
              "string",
              "null"
            ]
          },
          "verifiedCommit": {
            "type": [
              "string",
              "null"
            ]
          },
          "lastVerifiedAt": {
            "type": [
              "string",
              "null"
            ],
            "format": "date-time"
          },
          "notes": {
            "type": [
              "string",
              "null"
            ]
          }
        }
      }
    },
    "unmappedResources": {
      "type": "array",
      "description": "Observed repository resources not yet assigned a verified route.",
      "items": {
        "type": "object",
        "additionalProperties": false,
        "required": [
          "path",
          "url",
          "blobSha",
          "sizeBytes",
          "status"
        ],
        "properties": {
          "path": {
            "type": "string",
            "minLength": 1
          },
          "url": {
            "type": "string",
            "format": "uri"
          },
          "blobSha": {
            "type": "string",
            "pattern": "^[0-9a-f]{40}$"
          },
          "sizeBytes": {
            "type": "integer",
            "minimum": 0
          },
          "status": {
            "type": "string",
            "const": "UNMAPPED"
          },
          "notes": {
            "type": [
              "string",
              "null"
            ]
          }
        }
      }
    }
  }
}
