{
  "schemaVersion": "2.0.0",
  "registryStatus": "PARTIALLY_VERIFIED",
  "lastInventoryAt": null,
  "repositories": [
    {
      "repositoryId": "R-ALI-NEW",
      "fullName": "AligasSRM/ALI-NEW",
      "url": "https://github.com/AligasSRM/ALI-NEW",
      "approvalStatus": "APPROVED",
      "defaultBranch": "main",
      "visibility": "PUBLIC",
      "lastInspectedCommit": "ee785df4944642577b1aeedbf1ed2bf36f709316",
      "lastSuccessfulSyncAt": null
    }
  ],
  "nodes": [
    {
      "id": "A0",
      "level": "A",
      "parentId": null,
      "name": "جرد المشروع ولوحة التحكم",
      "status": "YELLOW",
      "resourceType": "SECTION",
      "notes": "Engineering phase in the existing Ali Tree; status reflects current project map, not a production-readiness claim."
    },
    {
      "id": "A1",
      "level": "A",
      "parentId": null,
      "name": "تعريف المنتج",
      "status": "PLANNED",
      "resourceType": "SECTION",
      "notes": "Engineering phase in the existing Ali Tree; status reflects current project map, not a production-readiness claim."
    },
    {
      "id": "A2",
      "level": "A",
      "parentId": null,
      "name": "تجربة المستخدم والتصميم",
      "status": "YELLOW",
      "resourceType": "SECTION",
      "notes": "Engineering phase in the existing Ali Tree; status reflects current project map, not a production-readiness claim."
    },
    {
      "id": "A3",
      "level": "A",
      "parentId": null,
      "name": "المعمارية والحدود",
      "status": "PLANNED",
      "resourceType": "SECTION",
      "notes": "Engineering phase in the existing Ali Tree; status reflects current project map, not a production-readiness claim."
    },
    {
      "id": "A4",
      "level": "A",
      "parentId": null,
      "name": "المستودع وسير المطورين",
      "status": "PLANNED",
      "resourceType": "SECTION",
      "notes": "Engineering phase in the existing Ali Tree; status reflects current project map, not a production-readiness claim."
    },
    {
      "id": "A5",
      "level": "A",
      "parentId": null,
      "name": "الهوية والتحقق",
      "status": "PLANNED",
      "resourceType": "SECTION",
      "notes": "Engineering phase in the existing Ali Tree; status reflects current project map, not a production-readiness claim."
    },
    {
      "id": "A6",
      "level": "A",
      "parentId": null,
      "name": "منتج الفيديو الأساسي",
      "status": "PLANNED",
      "resourceType": "SECTION",
      "notes": "Engineering phase in the existing Ali Tree; status reflects current project map, not a production-readiness claim."
    },
    {
      "id": "A7",
      "level": "A",
      "parentId": null,
      "name": "الإشراف والسلامة",
      "status": "PLANNED",
      "resourceType": "SECTION",
      "notes": "Engineering phase in the existing Ali Tree; status reflects current project map, not a production-readiness claim."
    },
    {
      "id": "A8",
      "level": "A",
      "parentId": null,
      "name": "الاكتشاف والمجتمع",
      "status": "PLANNED",
      "resourceType": "SECTION",
      "notes": "Engineering phase in the existing Ali Tree; status reflects current project map, not a production-readiness claim."
    },
    {
      "id": "A9",
      "level": "A",
      "parentId": null,
      "name": "الإدارة والتشغيل",
      "status": "PLANNED",
      "resourceType": "SECTION",
      "notes": "Engineering phase in the existing Ali Tree; status reflects current project map, not a production-readiness claim."
    },
    {
      "id": "A10",
      "level": "A",
      "parentId": null,
      "name": "البيانات والتكاملات",
      "status": "PLANNED",
      "resourceType": "SECTION",
      "notes": "Engineering phase in the existing Ali Tree; status reflects current project map, not a production-readiness claim."
    },
    {
      "id": "A11",
      "level": "A",
      "parentId": null,
      "name": "الأمن والخصوصية والجودة",
      "status": "PLANNED",
      "resourceType": "SECTION",
      "notes": "Engineering phase in the existing Ali Tree; status reflects current project map, not a production-readiness claim."
    },
    {
      "id": "A12",
      "level": "A",
      "parentId": null,
      "name": "الإطلاق والصيانة",
      "status": "PLANNED",
      "resourceType": "SECTION",
      "notes": "Engineering phase in the existing Ali Tree; status reflects current project map, not a production-readiness claim."
    },
    {
      "id": "B0",
      "level": "B",
      "name": "واجهة شجرة علي التفاعلية الحالية",
      "status": "YELLOW",
      "resourceType": "FILE",
      "repositoryFullName": "AligasSRM/ALI-NEW",
      "path": "index.html",
      "url": "https://github.com/AligasSRM/ALI-NEW/blob/main/index.html",
      "branch": "main",
      "verifiedCommit": "ee785df4944642577b1aeedbf1ed2bf36f709316",
      "notes": "Path observed in the GitHub tree and matched to the existing Ali Tree entry. Content and behaviour have not been fully certified by this inventory. Migrated from legacy grouping A0/B0; the physical path is unchanged.",
      "parentId": "A0"
    },
    {
      "id": "B1",
      "level": "B",
      "name": "وثيقة البناء والتسلسل المعتمدة",
      "status": "YELLOW",
      "resourceType": "DOCUMENT",
      "repositoryFullName": "AligasSRM/ALI-NEW",
      "path": "PROJECT-BUILD-TREE.md",
      "url": "https://github.com/AligasSRM/ALI-NEW/blob/main/PROJECT-BUILD-TREE.md",
      "branch": "main",
      "verifiedCommit": "ee785df4944642577b1aeedbf1ed2bf36f709316",
      "notes": "Path observed in the GitHub tree and matched to the existing Ali Tree entry. Content and behaviour have not been fully certified by this inventory. Migrated from legacy grouping A0/B1; the physical path is unchanged.",
      "parentId": "A0"
    },
    {
      "id": "B2",
      "level": "B",
      "name": "مدخل المستودع ونقطة الاستئناف",
      "status": "YELLOW",
      "resourceType": "DOCUMENT",
      "repositoryFullName": "AligasSRM/ALI-NEW",
      "path": "README.md",
      "url": "https://github.com/AligasSRM/ALI-NEW/blob/main/README.md",
      "branch": "main",
      "verifiedCommit": "ee785df4944642577b1aeedbf1ed2bf36f709316",
      "notes": "Path observed in the GitHub tree and matched to the existing Ali Tree entry. Content and behaviour have not been fully certified by this inventory. Migrated from legacy grouping A0/B1; the physical path is unchanged.",
      "parentId": "A0"
    },
    {
      "id": "B3",
      "level": "B",
      "name": "تعليمات الهندسة الرئيسية",
      "status": "YELLOW",
      "resourceType": "DOCUMENT",
      "repositoryFullName": "AligasSRM/ALI-NEW",
      "path": "ALI-ALEX-MASTER-PROJECT-PROMPT.md",
      "url": "https://github.com/AligasSRM/ALI-NEW/blob/main/ALI-ALEX-MASTER-PROJECT-PROMPT.md",
      "branch": "main",
      "verifiedCommit": "ee785df4944642577b1aeedbf1ed2bf36f709316",
      "notes": "Path observed in the GitHub tree and matched to the existing Ali Tree entry. Content and behaviour have not been fully certified by this inventory. Migrated from legacy grouping A0/B1; the physical path is unchanged.",
      "parentId": "A0"
    },
    {
      "id": "B4",
      "level": "B",
      "name": "سجل الأفكار",
      "status": "YELLOW",
      "resourceType": "DOCUMENT",
      "repositoryFullName": "AligasSRM/ALI-NEW",
      "path": "IDEAS-ALI-ALEX.md",
      "url": "https://github.com/AligasSRM/ALI-NEW/blob/main/IDEAS-ALI-ALEX.md",
      "branch": "main",
      "verifiedCommit": "ee785df4944642577b1aeedbf1ed2bf36f709316",
      "notes": "Path observed in the GitHub tree and matched to the existing Ali Tree entry. Content and behaviour have not been fully certified by this inventory. Migrated from legacy grouping A0/B1; the physical path is unchanged.",
      "parentId": "A0"
    },
    {
      "id": "B5",
      "level": "B",
      "name": "فهرس قرارات المشروع",
      "status": "YELLOW",
      "resourceType": "DOCUMENT",
      "repositoryFullName": "AligasSRM/ALI-NEW",
      "path": "docs/decisions/README.md",
      "url": "https://github.com/AligasSRM/ALI-NEW/blob/main/docs/decisions/README.md",
      "branch": "main",
      "verifiedCommit": "ee785df4944642577b1aeedbf1ed2bf36f709316",
      "notes": "Path observed in the GitHub tree and matched to the existing Ali Tree entry. Content and behaviour have not been fully certified by this inventory. Migrated from legacy grouping A0/B1; the physical path is unchanged.",
      "parentId": "A0"
    },
    {
      "id": "B6",
      "level": "B",
      "name": "اختبارات قبول لوحة التحكم",
      "status": "YELLOW",
      "resourceType": "TEST",
      "repositoryFullName": "AligasSRM/ALI-NEW",
      "path": "tests/ali-new-a0.spec.ts",
      "url": "https://github.com/AligasSRM/ALI-NEW/blob/main/tests/ali-new-a0.spec.ts",
      "branch": "main",
      "verifiedCommit": "ee785df4944642577b1aeedbf1ed2bf36f709316",
      "notes": "Path observed in the GitHub tree and matched to the existing Ali Tree entry. Content and behaviour have not been fully certified by this inventory. Migrated from legacy grouping A0/B2; the physical path is unchanged.",
      "parentId": "A0"
    },
    {
      "id": "B7",
      "level": "B",
      "name": "اختبارات صفحات النشر الحية",
      "status": "YELLOW",
      "resourceType": "TEST",
      "repositoryFullName": "AligasSRM/ALI-NEW",
      "path": "tests/live-pages.spec.ts",
      "url": "https://github.com/AligasSRM/ALI-NEW/blob/main/tests/live-pages.spec.ts",
      "branch": "main",
      "verifiedCommit": "ee785df4944642577b1aeedbf1ed2bf36f709316",
      "notes": "Path observed in the GitHub tree and matched to the existing Ali Tree entry. Content and behaviour have not been fully certified by this inventory. Migrated from legacy grouping A0/B2; the physical path is unchanged.",
      "parentId": "A0"
    },
    {
      "id": "B8",
      "level": "B",
      "name": "مدقق المصدر الثابت",
      "status": "YELLOW",
      "resourceType": "FILE",
      "repositoryFullName": "AligasSRM/ALI-NEW",